{"assetId":"01KZ07NAKW18AQVA4T4PZSSH3M","boundsCheck":{"checked":1,"ok":true,"violations":[]},"cacheHits":0,"indexId":"DB5DNV6SAMNX9JMCRGSCGEB7PQ","indexPath":"index/source-index-DB5DNV6SAMNX9JMCRGSCGEB7PQ.json","indexerVersion":"1.0.0","jobId":"e2e-mixed-1","momentCount":1,"momentsPath":"moments/moments-DB5DNV6SAMNX9JMCRGSCGEB7PQ.json","subStages":[{"cacheHit":false,"durationMs":14578,"name":"transcript","reason":null,"status":"completed"},{"cacheHit":false,"durationMs":2250,"name":"shots","reason":null,"status":"completed"},{"cacheHit":false,"durationMs":125,"name":"scenes","reason":null,"status":"completed"},{"cacheHit":false,"durationMs":56358,"name":"ocr","reason":null,"status":"completed"},{"cacheHit":false,"durationMs":0,"name":"visual_descriptions","reason":"visual descriptions disabled (--no-vlm); the D-21 spend ceiling is owner-set and not yet configured","status":"skipped"},{"cacheHit":false,"durationMs":6844,"name":"audio_events","reason":null,"status":"completed"},{"cacheHit":false,"durationMs":1797,"name":"quality_flags","reason":null,"status":"completed"},{"cacheHit":false,"durationMs":0,"name":"moment_extraction","reason":null,"status":"completed"}],"warnings":["visual descriptions disabled (--no-vlm); the D-21 spend ceiling is owner-set and not yet configured"]}