{"assetId":"01KZ087TS6X67NY8JDQE3A16KD","boundsCheck":{"checked":7,"ok":true,"violations":[]},"cacheHits":3,"indexId":"RPZ2S8F58Q10Y02T8E6VBBWDTB","indexPath":"index/source-index-RPZ2S8F58Q10Y02T8E6VBBWDTB.json","indexerVersion":"1.0.0","jobId":"e2e-mixed-1","momentCount":7,"momentsPath":"moments/moments-RPZ2S8F58Q10Y02T8E6VBBWDTB.json","subStages":[{"cacheHit":true,"durationMs":0,"name":"transcript","reason":null,"status":"completed"},{"cacheHit":true,"durationMs":14,"name":"shots","reason":null,"status":"completed"},{"cacheHit":true,"durationMs":32,"name":"scenes","reason":null,"status":"completed"},{"cacheHit":false,"durationMs":150500,"name":"ocr","reason":null,"status":"completed"},{"cacheHit":false,"durationMs":15,"name":"visual_descriptions","reason":"visual descriptions disabled (--no-vlm); the D-21 spend ceiling is owner-set and not yet configured","status":"skipped"},{"cacheHit":false,"durationMs":6437,"name":"audio_events","reason":null,"status":"completed"},{"cacheHit":false,"durationMs":8203,"name":"quality_flags","reason":null,"status":"completed"},{"cacheHit":false,"durationMs":0,"name":"moment_extraction","reason":null,"status":"completed"}],"warnings":["visual descriptions disabled (--no-vlm); the D-21 spend ceiling is owner-set and not yet configured"]}